component,provided_code_solution,why_not_like_for_like,expansion_needed_in_improved_code
Preliminary runs,abm_ec_simulation_v2.py runs 40 steps and shows qualitative remodelling on the looped geometry,"Useful scaffold, but no output is directly comparable to the paper's BR1/BR3/BR5 story","Use the scaffold only as a starting benchmark, not as the final scientific model"
Branch-rule semantics,Default branch_rule=3 is a shear-based router; branch_rule=2/6 are flow-based; no paper BR5 competition,"Rule IDs do not map onto Edgar et al.'s BR1-BR5 set, so the central bifurcation comparison cannot be reproduced","Implement explicit BR1-BR5 logic, especially BR5 as a weighted WSS-cell-number rule"
Polarity update,Weighted vector-sum heuristic with optional neighbour alignment,Differs from the source rotation rule that defines how cells realign against flow,Use either signed-angle rotation against flow or an explicitly documented mixed-polarity variant
Migration trigger and transport,"Ad hoc mchance=0.01, cosine threshold, global-coordinate polarity transport",Cell movement statistics and turns are not source-matched at corners and bifurcations,Use a projection threshold >= w/2 plus explicit segment-aware turns
Boundary and remodelling safeguards,"Minimum diameter floor, no periodic recycling, no intercalation smoothing","These choices alter depletion, cell conservation, and local branch-loss dynamics",Recycle outlet cells to the inlet and apply intercalation away from bifurcations
Endpoints and readouts,No paper-matched terminal-segment loss endpoint or joint topology-plus-hierarchy criterion,A run may look stable while still failing the biological hierarchy test,Score loss on the terminal convergent segments and report joint success
Flow/geometry scaffold,Correct looped A-branch geometry with dynamic conductance update is present,This part is already useful and worth retaining,Keep the geometry/flow scaffold while replacing the rule and state-update logic
